{
  "version": 1,
  "repository": {
    "name": "brown-wholesale",
    "ref": "46be8f57ead08d0f957c4af7ff9321224a668f6a",
    "commit": "46be8f57ead08d0f957c4af7ff9321224a668f6a"
  },
  "default_view": "network",
  "runtime": {
    "node_ids": [
      "cloudflare-apim-proxy",
      "wholesale-api-management",
      "fireball-event-publisher-function-app",
      "bridge-epay-function-app",
      "wholesale-service-bus-private-endpoint",
      "wholesale-service-bus-namespace",
      "wholesale-key-vault-private-endpoint",
      "wholesale-key-vault",
      "wholesale-sql-private-endpoint",
      "wholesale-sql-server",
      "wholesale-elastic-pool",
      "function-storage-blob-private-endpoint",
      "function-storage-file-private-endpoint",
      "function-storage-queue-private-endpoint",
      "function-storage-table-private-endpoint",
      "wholesale-function-storage-account",
      "wholesale-application-insights",
      "wholesale-log-analytics-workspace",
      "enterprise-network-virtual-appliance"
    ],
    "path_ids": [
      "cloudflare-to-wholesale-api-management",
      "api-management-to-fireball-event-publisher",
      "api-management-to-bridge-epay",
      "fireball-to-service-bus-private-endpoint",
      "fireball-to-key-vault-private-endpoint",
      "fireball-to-sql-private-endpoint",
      "bridge-epay-to-storage-queue-private-endpoint",
      "service-bus-private-link-target",
      "key-vault-private-link-target",
      "sql-private-link-target",
      "storage-blob-private-link-target",
      "storage-file-private-link-target",
      "storage-queue-private-link-target",
      "storage-table-private-link-target",
      "sql-server-to-elastic-pool",
      "api-management-to-application-insights",
      "application-insights-to-log-analytics",
      "wholesale-applications-to-enterprise-egress"
    ]
  },
  "network": {
    "containers": [
      {
        "id": "wholesale-development-subscription",
        "kind": "subscription",
        "label": "Wholesale 346 development subscription",
        "status": "active",
        "evidence": [
          {
            "path": "bicep/foundation/network/consts.bicep",
            "lines": "7-12",
            "claim": "The Wholesale development VNet is assigned to the Wholesale development subscription."
          }
        ]
      },
      {
        "id": "wholesale-network-resource-group",
        "kind": "resource-group",
        "label": "RG-WHS-346-Network-CentralUS-DEV",
        "status": "active",
        "evidence": [
          {
            "path": "bicep/foundation/network/consts.bicep",
            "lines": "7-12",
            "claim": "The Wholesale development VNet belongs to the named Network resource group."
          }
        ],
        "parent_id": "wholesale-development-subscription"
      },
      {
        "id": "wholesale-runtime-resource-group",
        "kind": "resource-group",
        "label": "RG-WHS-346-Wholesale-CentralUS-DEV",
        "status": "active",
        "evidence": [
          {
            "path": "docs/diagrams/decus-wholesale-bicep-traffic-audit.md",
            "lines": "164-172",
            "claim": "Wholesale shared routing, compute, messaging, secrets, storage, and observability resources are deployed as decomposed services."
          }
        ],
        "parent_id": "wholesale-development-subscription"
      },
      {
        "id": "wholesale-data-resource-group",
        "kind": "resource-group",
        "label": "RG-WHS-346-Data-CentralUS-DEV",
        "status": "active",
        "evidence": [
          {
            "path": "docs/diagrams/decus-wholesale-bicep-traffic-audit.md",
            "lines": "169-170",
            "claim": "Wholesale SQL Server, elastic pool, databases, and SQL private endpoint form the data foundation."
          }
        ],
        "parent_id": "wholesale-development-subscription"
      },
      {
        "id": "wholesale-logging-resource-group",
        "kind": "resource-group",
        "label": "RG-WHS-346-Logging-CentralUS-DEV",
        "status": "active",
        "evidence": [
          {
            "path": "docs/diagrams/decus-wholesale-bicep-traffic-audit.md",
            "lines": "171-172",
            "claim": "Wholesale Application Insights and Log Analytics support APIM diagnostics."
          }
        ],
        "parent_id": "wholesale-development-subscription"
      },
      {
        "id": "wholesale-development-vnet",
        "kind": "vnet",
        "label": "VNET-WHS-346-CentralUS-DEV",
        "status": "active",
        "evidence": [
          {
            "path": "bicep/foundation/network/vnets/VNET-WHS-346-CentralUS-DEV.bicep",
            "lines": "13-17",
            "claim": "The VNet declares two development address spaces."
          }
        ],
        "parent_id": "wholesale-network-resource-group",
        "cidr": "10.234.132.0/22, 10.234.156.0/22"
      },
      {
        "id": "wholesale-apim-subnet",
        "kind": "subnet",
        "label": "SNET-WHS-346-APIM-CentralUS-DEV",
        "status": "active",
        "evidence": [
          {
            "path": "bicep/foundation/network/vnets/VNET-WHS-346-CentralUS-DEV.bicep",
            "lines": "40-47",
            "claim": "The APIM subnet uses 10.234.157.128/27."
          }
        ],
        "parent_id": "wholesale-development-vnet",
        "cidr": "10.234.157.128/27"
      },
      {
        "id": "wholesale-vnet-integration-subnet",
        "kind": "subnet",
        "label": "SNET-WHS-346-VNetIntegration-CentralUS-DEV",
        "status": "active",
        "evidence": [
          {
            "path": "bicep/foundation/network/vnets/VNET-WHS-346-CentralUS-DEV.bicep",
            "lines": "250-257",
            "claim": "The delegated VNet Integration subnet uses 10.234.156.64/26."
          }
        ],
        "parent_id": "wholesale-development-vnet",
        "cidr": "10.234.156.64/26"
      },
      {
        "id": "wholesale-data-subnet",
        "kind": "subnet",
        "label": "SNET-WHS-346-DATA-CentralUS-DEV",
        "status": "active",
        "evidence": [
          {
            "path": "bicep/foundation/network/vnets/VNET-WHS-346-CentralUS-DEV.bicep",
            "lines": "152-159",
            "claim": "The DATA subnet uses 10.234.132.0/25."
          }
        ],
        "parent_id": "wholesale-development-vnet",
        "cidr": "10.234.132.0/25"
      },
      {
        "id": "decus-development-subscription",
        "kind": "subscription",
        "label": "WHS-537 Decus development subscription",
        "status": "active",
        "evidence": [
          {
            "path": "docs/diagrams/decus-wholesale-bicep-traffic-audit.md",
            "lines": "21-23",
            "claim": "Decus 537 owns a separate East US 2 landing zone and foundation."
          }
        ]
      },
      {
        "id": "decus-network-resource-group",
        "kind": "resource-group",
        "label": "RG-WHS-537-Network-EastUS2-DEV",
        "status": "active",
        "evidence": [
          {
            "path": "docs/diagrams/decus-wholesale-bicep-traffic-audit.md",
            "lines": "178-180",
            "claim": "The Decus network is a separate East US 2 VNet with routed subnets."
          }
        ],
        "parent_id": "decus-development-subscription"
      },
      {
        "id": "decus-shared-resource-group",
        "kind": "resource-group",
        "label": "RG-WHS-537-DecusShared-EastUS2-DEV",
        "status": "active",
        "evidence": [
          {
            "path": "docs/diagrams/decus-wholesale-bicep-traffic-audit.md",
            "lines": "182-186",
            "claim": "The Decus shared root owns Key Vault, App Configuration, SQL Server, elastic pool, and Log Analytics."
          }
        ],
        "parent_id": "decus-development-subscription"
      },
      {
        "id": "decus-development-vnet",
        "kind": "vnet",
        "label": "VNET-WHS-537-EastUS2-DEV",
        "status": "active",
        "evidence": [
          {
            "path": "bicep/_noship/reference/decus-537-eastus2/vnet.json",
            "lines": "25-48",
            "claim": "Declares the East US 2 Decus development Virtual Network and address space."
          }
        ],
        "parent_id": "decus-network-resource-group",
        "cidr": "10.218.56.0/22"
      },
      {
        "id": "decus-app-subnet",
        "kind": "subnet",
        "label": "SNET-WHS-537-APP-EastUS2-DEV",
        "status": "active",
        "evidence": [
          {
            "path": "bicep/_noship/reference/decus-537-eastus2/vnet.json",
            "lines": "49-63",
            "claim": "Declares the Decus APP subnet and CIDR."
          }
        ],
        "parent_id": "decus-development-vnet",
        "cidr": "10.218.56.0/26"
      },
      {
        "id": "decus-data-subnet",
        "kind": "subnet",
        "label": "SNET-WHS-537-DATA-EastUS2-DEV",
        "status": "active",
        "evidence": [
          {
            "path": "bicep/_noship/reference/decus-537-eastus2/vnet.json",
            "lines": "65-78",
            "claim": "Declares the Decus DATA subnet and CIDR."
          }
        ],
        "parent_id": "decus-development-vnet",
        "cidr": "10.218.57.0/26"
      },
      {
        "id": "decus-vnet-integration-subnet",
        "kind": "subnet",
        "label": "SNET-WHS-537-DecusVNetIntegration-EastUS2-DEV",
        "status": "active",
        "evidence": [
          {
            "path": "bicep/_noship/reference/decus-537-eastus2/vnet.json",
            "lines": "80-100",
            "claim": "Declares the Decus Virtual Network Integration subnet, CIDR, and App Service Plan delegation."
          }
        ],
        "parent_id": "decus-development-vnet",
        "cidr": "10.218.58.0/26"
      },
      {
        "id": "decus-mdop-subnet",
        "kind": "subnet",
        "label": "SNET-WHS-537-MDOP-EastUS2-DEV",
        "status": "active",
        "evidence": [